{
  "schemaVersion": 1,
  "id": "sticky-cad-model",
  "name": "reTerminal Sticky 3D Model",
  "category": "reference",
  "summary": "A community-made reTerminal Sticky enclosure model for remixes and accessory design.",
  "description": "A community-made 3D model of the reTerminal Sticky enclosure. Use it to check fit when designing cases, stands, and mounts, or remix it into your own accessory. Published on Printables by Hendra Kusumah.",
  "author": {
    "name": "Hendra Kusumah",
    "url": "https://www.printables.com/@HendraKusuma_2346746"
  },
  "download": {
    "platform": "Printables",
    "url": "https://www.printables.com/model/1800955-seeed-studio-reterminal-sticky-3d-model"
  },
  "preview": {
    "image": "assets/preview.jpg",
    "alt": "reTerminal Sticky enclosure reference 3D model"
  },
  "tags": [
    "cad",
    "reference"
  ]
}
