{
  "schemaVersion": 1,
  "id": "example-case",
  "name": "Example Case",
  "category": "case",
  "summary": "One sentence shown on the card, for example: A slim snap-on case with open USB-C access.",
  "description": "Optional. Two or three sentences kept with the entry: what the design does, how it attaches to Sticky, and anything to know before printing.",
  "author": {
    "name": "Your name or team",
    "url": "https://www.printables.com/@your-profile"
  },
  "download": {
    "platform": "Printables",
    "url": "https://www.printables.com/model/example",
    "license": "CC BY-SA 4.0"
  },
  "preview": {
    "image": "assets/preview.jpg",
    "alt": "Example Case printed and fitted on reTerminal Sticky"
  },
  "tags": [
    "snap-on",
    "usb-c"
  ]
}
