{
  "schemaVersion": 1,
  "id": "sticky-table-stand",
  "name": "Sticky Table Stand",
  "category": "stand",
  "summary": "A desktop stand that holds reTerminal Sticky at a comfortable viewing angle.",
  "description": "A simple table stand that props reTerminal Sticky up at a readable angle for desk use. The CAD files are published on GrabCAD and can be exported to STL for printing.",
  "author": {
    "name": "Gokul",
    "url": "https://grabcad.com/library/table-stand-for-seeed-studio-sticky-1"
  },
  "download": {
    "platform": "GrabCAD",
    "url": "https://grabcad.com/library/table-stand-for-seeed-studio-sticky-1"
  },
  "preview": {
    "image": "assets/preview.jpg",
    "alt": "Sticky Table Stand holding reTerminal Sticky at an angle"
  },
  "tags": [
    "stand"
  ]
}
